{
  "schemaVersion":1,
  "project":{"name":"Example Tender Workspace","slug":"example-tender-workspace","type":"b2b-saas","primaryGoal":"Let small teams organise and review business documents."},
  "modules":{"auth":true,"profiles":true,"organisations":true,"admin":true,"uploads":true,"email":true,"audit-log":true,"analytics":true,"observability":true,"billing":false,"ai":false},
  "infrastructure":{"backend":"supabase","deployment":"netlify"},
  "aiBudget":{"mode":"economy","maxBuildCostGbp":5},
  "brand":{"direction":"professional","decisionMode":"show-design-directions"},
  "inputs":{"companyDetails":false,"assets":[]},
  "outOfScope":["billing","native mobile app"]
}
